{"schemaVersion":"1.0.0","measurementVersion":"host-review-measurement/1.0.0","metricVersion":"host-review-comparison-metrics/1.0.0","subjectCount":3,"measurementCount":6,"subjects":[{"subjectId":"public-sample-a","inputDigest":"sha256:c998e5dc8cc404897126277ec923c726448cb422051c996c75ecc4cb34c308d5","estimatorVersion":"seed-rules/0.2.1","profile":"implementation","compactMeasurementDigest":"sha256:5fef44b27cd02b244f686d5462c28da396629955ec83d74a5b5323e4f135f3ee","broaderSourceMeasurementDigest":"sha256:206977bfdbab40c6b30ebe1c7f0ce9d835dbf58d71156c5ad5b1b27948335dbc","capabilityItems":{"level":"capability-item","baselineAgreement":{"low":{"sampleCount":9,"referenceHours":13.50,"candidateHours":15.75,"absoluteErrorHours":4.75,"meanAbsoluteErrorHours":0.5278,"signedErrorHours":2.25,"weightedAbsolutePercentageError":0.3519,"aggregateBiasRate":0.1667},"expected":{"sampleCount":9,"referenceHours":21.75,"candidateHours":29.25,"absoluteErrorHours":8.00,"meanAbsoluteErrorHours":0.8889,"signedErrorHours":7.50,"weightedAbsolutePercentageError":0.3678,"aggregateBiasRate":0.3448},"high":{"sampleCount":9,"referenceHours":36.75,"candidateHours":52.00,"absoluteErrorHours":15.75,"meanAbsoluteErrorHours":1.75,"signedErrorHours":15.25,"weightedAbsolutePercentageError":0.4286,"aggregateBiasRate":0.4150},"interval":{"sampleCount":9,"referenceExpectedCoveredCount":9,"referenceExpectedCoverage":1,"referenceRangeFullyCoveredCount":4,"referenceRangeFullyCoveredRate":0.4444,"rangeOverlapCount":9,"rangeOverlapRate":1}},"compactAgreement":{"low":{"sampleCount":9,"referenceHours":13.50,"candidateHours":12.50,"absoluteErrorHours":2.00,"meanAbsoluteErrorHours":0.2222,"signedErrorHours":-1.00,"weightedAbsolutePercentageError":0.1481,"aggregateBiasRate":-0.0741},"expected":{"sampleCount":9,"referenceHours":21.75,"candidateHours":23.00,"absoluteErrorHours":1.75,"meanAbsoluteErrorHours":0.1944,"signedErrorHours":1.25,"weightedAbsolutePercentageError":0.0805,"aggregateBiasRate":0.0575},"high":{"sampleCount":9,"referenceHours":36.75,"candidateHours":39.25,"absoluteErrorHours":6.00,"meanAbsoluteErrorHours":0.6667,"signedErrorHours":2.50,"weightedAbsolutePercentageError":0.1633,"aggregateBiasRate":0.0680},"interval":{"sampleCount":9,"referenceExpectedCoveredCount":9,"referenceExpectedCoverage":1,"referenceRangeFullyCoveredCount":5,"referenceRangeFullyCoveredRate":0.5556,"rangeOverlapCount":9,"rangeOverlapRate":1}},"baselineToCompactAbsoluteExpectedCorrectionHours":6.25,"baselineToReferenceAbsoluteExpectedCorrectionHours":8.00,"expectedAbsoluteErrorReductionHours":6.25,"expectedAbsoluteErrorReductionRate":0.7813},"categories":{"level":"category","baselineAgreement":{"low":{"sampleCount":11,"referenceHours":14.75,"candidateHours":17.00,"absoluteErrorHours":4.75,"meanAbsoluteErrorHours":0.4318,"signedErrorHours":2.25,"weightedAbsolutePercentageError":0.3220,"aggregateBiasRate":0.1525},"expected":{"sampleCount":11,"referenceHours":24.00,"candidateHours":31.50,"absoluteErrorHours":8.00,"meanAbsoluteErrorHours":0.7273,"signedErrorHours":7.50,"weightedAbsolutePercentageError":0.3333,"aggregateBiasRate":0.3125},"high":{"sampleCount":11,"referenceHours":40.75,"candidateHours":56.00,"absoluteErrorHours":15.75,"meanAbsoluteErrorHours":1.4318,"signedErrorHours":15.25,"weightedAbsolutePercentageError":0.3865,"aggregateBiasRate":0.3742},"interval":{"sampleCount":11,"referenceExpectedCoveredCount":11,"referenceExpectedCoverage":1,"referenceRangeFullyCoveredCount":6,"referenceRangeFullyCoveredRate":0.5455,"rangeOverlapCount":11,"rangeOverlapRate":1}},"compactAgreement":{"low":{"sampleCount":11,"referenceHours":14.75,"candidateHours":13.75,"absoluteErrorHours":2.00,"meanAbsoluteErrorHours":0.1818,"signedErrorHours":-1.00,"weightedAbsolutePercentageError":0.1356,"aggregateBiasRate":-0.0678},"expected":{"sampleCount":11,"referenceHours":24.00,"candidateHours":25.25,"absoluteErrorHours":1.75,"meanAbsoluteErrorHours":0.1591,"signedErrorHours":1.25,"weightedAbsolutePercentageError":0.0729,"aggregateBiasRate":0.0521},"high":{"sampleCount":11,"referenceHours":40.75,"candidateHours":43.25,"absoluteErrorHours":6.00,"meanAbsoluteErrorHours":0.5455,"signedErrorHours":2.50,"weightedAbsolutePercentageError":0.1472,"aggregateBiasRate":0.0613},"interval":{"sampleCount":11,"referenceExpectedCoveredCount":11,"referenceExpectedCoverage":1,"referenceRangeFullyCoveredCount":7,"referenceRangeFullyCoveredRate":0.6364,"rangeOverlapCount":11,"rangeOverlapRate":1}},"baselineToCompactAbsoluteExpectedCorrectionHours":6.25,"baselineToReferenceAbsoluteExpectedCorrectionHours":8.00,"expectedAbsoluteErrorReductionHours":6.25,"expectedAbsoluteErrorReductionRate":0.7813},"repositoryTotal":{"level":"repository-total","baselineAgreement":{"low":{"sampleCount":1,"referenceHours":14.75,"candidateHours":17.00,"absoluteErrorHours":2.25,"meanAbsoluteErrorHours":2.25,"signedErrorHours":2.25,"weightedAbsolutePercentageError":0.1525,"aggregateBiasRate":0.1525},"expected":{"sampleCount":1,"referenceHours":24.00,"candidateHours":31.50,"absoluteErrorHours":7.50,"meanAbsoluteErrorHours":7.50,"signedErrorHours":7.50,"weightedAbsolutePercentageError":0.3125,"aggregateBiasRate":0.3125},"high":{"sampleCount":1,"referenceHours":40.75,"candidateHours":56.00,"absoluteErrorHours":15.25,"meanAbsoluteErrorHours":15.25,"signedErrorHours":15.25,"weightedAbsolutePercentageError":0.3742,"aggregateBiasRate":0.3742},"interval":{"sampleCount":1,"referenceExpectedCoveredCount":1,"referenceExpectedCoverage":1,"referenceRangeFullyCoveredCount":0,"referenceRangeFullyCoveredRate":0,"rangeOverlapCount":1,"rangeOverlapRate":1}},"compactAgreement":{"low":{"sampleCount":1,"referenceHours":14.75,"candidateHours":13.75,"absoluteErrorHours":1.00,"meanAbsoluteErrorHours":1.00,"signedErrorHours":-1.00,"weightedAbsolutePercentageError":0.0678,"aggregateBiasRate":-0.0678},"expected":{"sampleCount":1,"referenceHours":24.00,"candidateHours":25.25,"absoluteErrorHours":1.25,"meanAbsoluteErrorHours":1.25,"signedErrorHours":1.25,"weightedAbsolutePercentageError":0.0521,"aggregateBiasRate":0.0521},"high":{"sampleCount":1,"referenceHours":40.75,"candidateHours":43.25,"absoluteErrorHours":2.50,"meanAbsoluteErrorHours":2.50,"signedErrorHours":2.50,"weightedAbsolutePercentageError":0.0613,"aggregateBiasRate":0.0613},"interval":{"sampleCount":1,"referenceExpectedCoveredCount":1,"referenceExpectedCoverage":1,"referenceRangeFullyCoveredCount":1,"referenceRangeFullyCoveredRate":1,"rangeOverlapCount":1,"rangeOverlapRate":1}},"baselineToCompactAbsoluteExpectedCorrectionHours":6.25,"baselineToReferenceAbsoluteExpectedCorrectionHours":7.50,"expectedAbsoluteErrorReductionHours":6.25,"expectedAbsoluteErrorReductionRate":0.8333},"telemetry":{"compact":{"observedInput":{"utf8Bytes":42653,"characterCount":42653,"approximateTokens":10664},"observedInputComplete":false,"queryCount":1,"selectedSourceQueryCount":0,"providerTokens":{"unavailableReason":"Telemetry was not supplied by the surrounding caller."},"elapsed":{"unavailableReason":"Telemetry was not supplied by the surrounding caller."},"cost":{"unavailableReason":"Telemetry was not supplied by the surrounding caller."}},"broaderSource":{"observedInput":{"utf8Bytes":39084,"characterCount":39084,"approximateTokens":9771},"observedInputComplete":false,"queryCount":0,"selectedSourceQueryCount":0,"providerTokens":{"unavailableReason":"Telemetry was not supplied by the surrounding caller."},"elapsed":{"unavailableReason":"Telemetry was not supplied by the surrounding caller."},"cost":{"unavailableReason":"Telemetry was not supplied by the surrounding caller."}},"diagnostics":["Observed-input ratios are unavailable because one or both sessions lack complete observed-input accounting.","Provider input-token ratio is unavailable because one or both sessions lack compatible telemetry.","Elapsed-time ratio is unavailable because one or both sessions lack measured duration.","Monetary-cost ratio is unavailable because cost is missing, zero, or uses incompatible currencies."]},"limitations":["The compact reviewer had broader source available before deciding, so context isolation was not blind.","The compact reviewer had the reference review available before deciding, creating anchoring risk.","The paired reviews are not recorded as independently performed."]},{"subjectId":"public-sample-b","inputDigest":"sha256:938b8db99b65e832cd174db3400664eec968094cb67ece29a8df6470b287f06e","estimatorVersion":"seed-rules/0.2.1","profile":"implementation","compactMeasurementDigest":"sha256:c57bf2d184fa3dd809a4d0f2204d944d0536e9c259ddd32feba9a22db504ccdc","broaderSourceMeasurementDigest":"sha256:b0d0faed9a1ee99480df8918259909baa324760a8ebed4b50edf944d028c9c0b","capabilityItems":{"level":"capability-item","baselineAgreement":{"low":{"sampleCount":12,"referenceHours":98.75,"candidateHours":90.25,"absoluteErrorHours":27.00,"meanAbsoluteErrorHours":2.25,"signedErrorHours":-8.50,"weightedAbsolutePercentageError":0.2734,"aggregateBiasRate":-0.0861},"expected":{"sampleCount":12,"referenceHours":158.5,"candidateHours":164.00,"absoluteErrorHours":38.50,"meanAbsoluteErrorHours":3.2083,"signedErrorHours":5.50,"weightedAbsolutePercentageError":0.2429,"aggregateBiasRate":0.0347},"high":{"sampleCount":12,"referenceHours":259.00,"candidateHours":285.00,"absoluteErrorHours":72.50,"meanAbsoluteErrorHours":6.0417,"signedErrorHours":26.00,"weightedAbsolutePercentageError":0.2799,"aggregateBiasRate":0.1004},"interval":{"sampleCount":12,"referenceExpectedCoveredCount":9,"referenceExpectedCoverage":0.75,"referenceRangeFullyCoveredCount":3,"referenceRangeFullyCoveredRate":0.25,"rangeOverlapCount":11,"rangeOverlapRate":0.9167}},"compactAgreement":{"low":{"sampleCount":12,"referenceHours":98.75,"candidateHours":83.50,"absoluteErrorHours":15.25,"meanAbsoluteErrorHours":1.2708,"signedErrorHours":-15.25,"weightedAbsolutePercentageError":0.1544,"aggregateBiasRate":-0.1544},"expected":{"sampleCount":12,"referenceHours":158.5,"candidateHours":146.75,"absoluteErrorHours"